{"actionable":false,"adapter_hash":"4925FDA816CDC529A70E850850C898033C2C593DCDF2940803C0815B63B9B508","adapter_version":"P1008_T1_DERIVED_KPI_ADAPTER_V1","as_of_date":"2026-09-18","candidate_id":"WR-T1-609C61B6D6F3E57C-4925FDA816CD","candidate_owner":"WAR_ROOM","created_at":"2026-09-27T00:00:00Z","data_tier":"T1_EXACT_DERIVED","dimension":"VALUATION","formal_authority":false,"formula_expression":"TEST_CLOSE_TWD / TEST_BVPS_TWD","formula_id":"P1008_PB_PRICE_DIV_BVPS","formula_version":"EXISTING_DAILY_PRICE_MANIFEST_V1","input_hashes":["E02C5F911B381D99EB6778F8898E92CAD5E0213D496F3DF446857DA0444BE85E","3BD898E967DB8553C6EF1B4BD1B5A2ECC33A37FFC020351F99306E3A006AD41A"],"input_source_ids":["TEST-OFFICIAL-CLOSE","TEST-GOVERNED-BVPS"],"input_source_locators":["TEST_ONLY://close","TEST_ONLY://bvps"],"metric_id":"TEST_PB_MULTIPLE","origin":"PLUGIN_DERIVED_T1","owner_review_required":true,"period":"2026-09-18","production_scoring_enabled":false,"publication":false,"schema_version":"P1008_T1_WAR_ROOM_CANDIDATE_V1","source_candidate_hash":"609C61B6D6F3E57CA80925626C1CA09C096B0CC7F0E93F416DE9DD0FD28EBFAF","source_candidate_id":"TEST-ONLY-PB-2026-09-18-V1","synthetic_fixture":true,"unit":"MULTIPLE","validation_receipt_hash":"B2BE30CF76310DDC56031E35A17AE68D9398F9919F43380A192A6BB5EDAEB77D","validation_receipt_id":"T1VR-609C61B6D6F3E57C-4925FDA816CD","value":"2.000"}
